{"schema_version":3,"baseline_head":"db58f0d723a2deff0640951933424b66084695d6","ledger_digest":"sha256:877c01cccdb082606446d94452d0f3fe06b3d0e74827fa06888c4a1c492ad35e","summary_digest":"sha256:37e6dbfb271ce4f3037ed72eff8ef1c7bf6bd041f44a547402e8b526c7373612","paths":["catalog/indexes/manifest.json","catalog/runs/run_95f5eeec43304235/demand.json","catalog/runs/run_95f5eeec43304235/events/0-init.json","catalog/runs/run_95f5eeec43304235/events/1-maintenance.json","catalog/runs/run_95f5eeec43304235/events/2-issues.json","catalog/runs/run_95f5eeec43304235/events/3-paused_for_assessment.json","catalog/runs/run_95f5eeec43304235/events/4-context.json","catalog/runs/run_95f5eeec43304235/events/5-paused_for_targets.json","catalog/runs/run_95f5eeec43304235/events/6-targets.json","catalog/runs/run_95f5eeec43304235/events/7-gate.json","catalog/runs/run_95f5eeec43304235/gate-evidence/analysis_binding_test.stderr.log","catalog/runs/run_95f5eeec43304235/gate-evidence/analysis_binding_test.stdout.log","catalog/runs/run_95f5eeec43304235/gate-evidence/catalog_impact.stderr.log","catalog/runs/run_95f5eeec43304235/gate-evidence/catalog_impact.stdout.log","catalog/runs/run_95f5eeec43304235/gate-evidence/catalog_reset_test.stderr.log","catalog/runs/run_95f5eeec43304235/gate-evidence/catalog_reset_test.stdout.log","catalog/runs/run_95f5eeec43304235/gate-evidence/catalog_status.stderr.log","catalog/runs/run_95f5eeec43304235/gate-evidence/catalog_status.stdout.log","catalog/runs/run_95f5eeec43304235/gate-evidence/catalog_validate.stderr.log","catalog/runs/run_95f5eeec43304235/gate-evidence/catalog_validate.stdout.log","catalog/runs/run_95f5eeec43304235/gate-evidence/evaluation_binding_test.stderr.log","catalog/runs/run_95f5eeec43304235/gate-evidence/evaluation_binding_test.stdout.log","catalog/runs/run_95f5eeec43304235/gate-evidence/issue_intake_test.stderr.log","catalog/runs/run_95f5eeec43304235/gate-evidence/issue_intake_test.stdout.log","catalog/runs/run_95f5eeec43304235/gate-evidence/issue_pipeline_test.stderr.log","catalog/runs/run_95f5eeec43304235/gate-evidence/issue_pipeline_test.stdout.log","catalog/runs/run_95f5eeec43304235/gate-evidence/issue_response_ledger_test.stderr.log","catalog/runs/run_95f5eeec43304235/gate-evidence/issue_response_ledger_test.stdout.log","catalog/runs/run_95f5eeec43304235/gate-evidence/issue_stage_test.stderr.log","catalog/runs/run_95f5eeec43304235/gate-evidence/issue_stage_test.stdout.log","catalog/runs/run_95f5eeec43304235/gate-evidence/nightly_controller_test.stderr.log","catalog/runs/run_95f5eeec43304235/gate-evidence/nightly_controller_test.stdout.log","catalog/runs/run_95f5eeec43304235/gate-evidence/nightly_legacy_absence_test.stderr.log","catalog/runs/run_95f5eeec43304235/gate-evidence/nightly_legacy_absence_test.stdout.log","catalog/runs/run_95f5eeec43304235/gate-evidence/nightly_runtime_test.stderr.log","catalog/runs/run_95f5eeec43304235/gate-evidence/nightly_runtime_test.stdout.log","catalog/runs/run_95f5eeec43304235/gate-evidence/pack_core_test.stderr.log","catalog/runs/run_95f5eeec43304235/gate-evidence/pack_core_test.stdout.log","catalog/runs/run_95f5eeec43304235/gate-evidence/pack_destination_test.stderr.log","catalog/runs/run_95f5eeec43304235/gate-evidence/pack_destination_test.stdout.log","catalog/runs/run_95f5eeec43304235/gate-evidence/pack_preflight_test.stderr.log","catalog/runs/run_95f5eeec43304235/gate-evidence/pack_preflight_test.stdout.log","catalog/runs/run_95f5eeec43304235/gate-evidence/pack_promotion_test.stderr.log","catalog/runs/run_95f5eeec43304235/gate-evidence/pack_promotion_test.stdout.log","catalog/runs/run_95f5eeec43304235/gate-evidence/pack_proof_test.stderr.log","catalog/runs/run_95f5eeec43304235/gate-evidence/pack_proof_test.stdout.log","catalog/runs/run_95f5eeec43304235/gate-evidence/pack_schema_test.stderr.log","catalog/runs/run_95f5eeec43304235/gate-evidence/pack_schema_test.stdout.log","catalog/runs/run_95f5eeec43304235/gate-evidence/path_safety_test.stderr.log","catalog/runs/run_95f5eeec43304235/gate-evidence/path_safety_test.stdout.log","catalog/runs/run_95f5eeec43304235/gate-evidence/publish_boundary.stderr.log","catalog/runs/run_95f5eeec43304235/gate-evidence/publish_boundary.stdout.log","catalog/runs/run_95f5eeec43304235/gate-evidence/publish_check.stderr.log","catalog/runs/run_95f5eeec43304235/gate-evidence/publish_check.stdout.log","catalog/runs/run_95f5eeec43304235/gate-evidence/publish_links.stderr.log","catalog/runs/run_95f5eeec43304235/gate-evidence/publish_links.stdout.log","catalog/runs/run_95f5eeec43304235/gate-evidence/publish_pack_v3_test.stderr.log","catalog/runs/run_95f5eeec43304235/gate-evidence/publish_pack_v3_test.stdout.log","catalog/runs/run_95f5eeec43304235/gate-evidence/publish_summaries.stderr.log","catalog/runs/run_95f5eeec43304235/gate-evidence/publish_summaries.stdout.log","catalog/runs/run_95f5eeec43304235/gate-evidence/relations_v2_test.stderr.log","catalog/runs/run_95f5eeec43304235/gate-evidence/relations_v2_test.stdout.log","catalog/runs/run_95f5eeec43304235/gate-evidence/skill_extraction_test.stderr.log","catalog/runs/run_95f5eeec43304235/gate-evidence/skill_extraction_test.stdout.log","catalog/runs/run_95f5eeec43304235/gate-evidence/skill_normalization_bootstrap_test.stderr.log","catalog/runs/run_95f5eeec43304235/gate-evidence/skill_normalization_bootstrap_test.stdout.log","catalog/runs/run_95f5eeec43304235/gate-evidence/source_http_classifier_test.stderr.log","catalog/runs/run_95f5eeec43304235/gate-evidence/source_http_classifier_test.stdout.log","catalog/runs/run_95f5eeec43304235/issue-drafts.json","catalog/runs/run_95f5eeec43304235/issue-workload.json","catalog/runs/run_95f5eeec43304235/outputs/audit_run_95f5eeec43304235.json","catalog/runs/run_95f5eeec43304235/outputs/gate-result.json","catalog/runs/run_95f5eeec43304235/outputs/init-evidence.json","catalog/runs/run_95f5eeec43304235/outputs/issue-assessment-handoff.json","catalog/runs/run_95f5eeec43304235/outputs/issues-finalized.json","catalog/runs/run_95f5eeec43304235/outputs/issues-prepared.json","catalog/runs/run_95f5eeec43304235/outputs/maintenance.json","catalog/runs/run_95f5eeec43304235/outputs/run-context.json","catalog/runs/run_95f5eeec43304235/outputs/seal-manifest.json","catalog/runs/run_95f5eeec43304235/outputs/seal.json","catalog/runs/run_95f5eeec43304235/outputs/target-execution-handoff.json","catalog/runs/run_95f5eeec43304235/outputs/targets-finalized.json","catalog/runs/run_95f5eeec43304235/stages-issues.json","catalog/runs/run_95f5eeec43304235/target-result.json","catalog/sources/registry.yaml","catalog/sources/snapshots/src_https-github-com-addyosmani-agent-skills-addyosmani-agent-skills_ec0a2dc8-f03b4a84b08b.json","catalog/sources/snapshots/src_https-github-com-alirezarezvani-claude-skills-alirezarezvani-claude-skills_1b18c64e-aa8d778811a5.json","catalog/sources/snapshots/src_https-github-com-anthropics-skills-anthropic-agent-skills_04f79b56-b29e7cf65e5c.json","catalog/sources/snapshots/src_https-github-com-coderabbitai-skills-coderabbit-skills_8f2a22eb-bbb4ab25a7f1.json","catalog/sources/snapshots/src_https-github-com-coreyhaines31-marketingskills-marketing-skills-corey-haines_ef920698-7868cb9251fa.json","catalog/sources/snapshots/src_https-github-com-cuga-project-cuga-agent-cuga-agent-ibm-research_5709bc42-259a90bafe08.json","catalog/sources/snapshots/src_https-github-com-figma-mcp-server-guide-figma-mcp-skills_dde79ddd-22b2c566d988.json","catalog/sources/snapshots/src_https-github-com-fujishigetemma-semantic-scholar-mcp-semantic-scholar-mcp-server_1c7ee5c5-ead98e835620.json","catalog/sources/snapshots/src_https-github-com-github-awesome-copilot-github-awesome-copilot_7a815055-6c7fe1b15f1b.json","catalog/sources/snapshots/src_https-github-com-google-skills-google-skills_bc973af1-777fb8e194b9.json","catalog/sources/snapshots/src_https-github-com-hermeticormus-markdown-discipline-skills-markdown-discipline-skills_ddaf87e0-ae8c782f68db.json","catalog/sources/snapshots/src_https-github-com-jeffallan-claude-skills-jeffallan-claude-skills_4cac5418-e8be415bc94d.json","catalog/sources/snapshots/src_https-github-com-jupyterlab-jupyter-ai-jupyter-ai-jupyterlab_e47112b5-1e7ad24042b2.json","catalog/sources/snapshots/src_https-github-com-k-dense-ai-scientific-agent-skills-k-dense-scientific-agent-skills_5bdb6d39-d767725c6e93.json","catalog/sources/snapshots/src_https-github-com-kepano-obsidian-skills-kepano-obsidian-skills_ef40e459-a1dc48e68138.json","catalog/sources/snapshots/src_https-github-com-kozz36-frontend-designer-skill-frontend-designer-skill_929a1309-5e4dc12811bd.json","catalog/sources/snapshots/src_https-github-com-mcollina-skills-matteo-collina-s-skills_faf2f289-a88a866db5dc.json","docs/sources/src_https-github-com-addyosmani-agent-skills-addyosmani-agent-skills_ec0a2dc8.md","docs/sources/src_https-github-com-alirezarezvani-claude-skills-alirezarezvani-claude-skills_1b18c64e.md","docs/sources/src_https-github-com-anthropics-skills-anthropic-agent-skills_04f79b56.md","docs/sources/src_https-github-com-coderabbitai-skills-coderabbit-skills_8f2a22eb.md","docs/sources/src_https-github-com-coreyhaines31-marketingskills-marketing-skills-corey-haines_ef920698.md","docs/sources/src_https-github-com-cuga-project-cuga-agent-cuga-agent-ibm-research_5709bc42.md","docs/sources/src_https-github-com-figma-mcp-server-guide-figma-mcp-skills_dde79ddd.md","docs/sources/src_https-github-com-fujishigetemma-semantic-scholar-mcp-semantic-scholar-mcp-server_1c7ee5c5.md","docs/sources/src_https-github-com-github-awesome-copilot-github-awesome-copilot_7a815055.md","docs/sources/src_https-github-com-google-skills-google-skills_bc973af1.md","docs/sources/src_https-github-com-hermeticormus-markdown-discipline-skills-markdown-discipline-skills_ddaf87e0.md","docs/sources/src_https-github-com-jeffallan-claude-skills-jeffallan-claude-skills_4cac5418.md","docs/sources/src_https-github-com-jupyterlab-jupyter-ai-jupyter-ai-jupyterlab_e47112b5.md","docs/sources/src_https-github-com-k-dense